reg_no,registration_number,date_of_registration,project_name,project_status,project_type,project_location,proposed_completion_date,planning_authority,full_name_planning_authority,final_plot_bearing,total_land_area,land_area_applied,permissible_builtup,sanctioned_builtup,aggregate_open_space,project_address_full,promoter_type,name_of_partnership,promoter_official_address,partner_details.names,partner_details.designations,promoter_past_project_names,promoter_past_project_statuses,promoter_past_litigation_statuses,authorised_signatory_names,authorised_signatory_designations
P50500000005,P50500000005,20/05/2017,GREEN CITY 3,Ongoing,Residential / Group Housing,Maharashtra,31/12/2018,Others,,33/1/33/2/1,8120.96,8120.96,11566.5,11566.5,1171.45,"33/1/33/2/1, MAHARASHTRA, Nagpur, Nagpur (Rural), Gawasi Manapur, 441108, 18 Mtr Wide Road, Remaining Part of Survey No 33-1-2, 12 Mtr Wide Road, Survey No 42, 21.017065000000000, 79.058966000000000",Partnership,GREEN SPACE INFRA VENTURES,"PLOT NO E-4, Akshay Heights 2, ONKAR NAGAR CEMENT ROAD, ONKAR NAGAR, Besides FEDEX, MAHARASHTRA, Nagpur, Nagpur (Urban), Nagpur (M Corp.), 440027","NARENDRA DHIRAJLAL MANDAVIYA, YAMINI NARENDRA MANDAVIYA, YASH NARENDRA MANDAVIYA, Veena Rajendra Mandaviya, RAJENDRA DHIRAJLAL MANDAVIYA, VIRAL RAJENDRA MANDAVIYA","Partner, Partner, Partner, Partner, Partner, Partner","Green City 1, Green City 2, Green City 3, Green City 4","Completed, Completed, Completed, Completed","No, No, No, No",,
P51700000002,P51700000002,09/05/2017,UNNATHI WOODS PHASE VII A,Ongoing,Residential / Group Housing,Maharashtra,30/12/2025,Others,,246 247/1 247/2,3425,3425,25663.69,7965.49,2808.87,"246 247/1 247/2, MAHARASHTRA, Thane, Thane, Thane (M Corp.), 400615, SURVEY NO 248, BOUNDARY OF VILLAGE VADAVALI, PARK RESERVATION, SURVEY NO 245-3, 19.268511000000000, 72.973670000000000",Partnership,UNNATHI ESTATES,"ROOM NO.26, 3RD FLOOR, KILACHAND BUILDING, 298 PRINCESS STREET, MARINE LINES, MUMBAI, MAHARASHTRA, Mumbai Suburban, Mumbai, Greater Mumbai (M Corp.) (Part) (802794), 400002","SHYAMAL VIJAY MODY, SUMIT VIJAY MODY, SANGEETA KIRTI SHAH, KUSHAL KIRTI SHAH","Partner, Partner, Partner, Partner","UNNATHI WOODS PHASE I, UNNATHI WOODS PHASE II, UNNATHIWOODS PHASE IV - BUILDING D AND E, UNNATHI WOODS PHASE III - C2","Completed, Completed, Completed, Completed","No, No, No, No",RAJAN NARAYAN BANDELKAR,Authorized Signatory
P51700000001,P51700000001,09/05/2017,MAYFAIR VISHWARAJA,Ongoing,Residential / Group Housing,Maharashtra,30/06/2018,Others,,S No 204/1A 226/1/2 226/2A,5847.98,5847.98,8422.85,8422.85,878.42,"S No 204/1A 226/1/2 226/2A, MAHARASHTRA, Thane, Kalyan, Titwala, 421605, Survey No 190, Survey No 226 Hissa No 1 1, Survey No 226 Hissa No 1p, D P Road, 19.300941738924593, 73.218581970330890",,,"1, MAYFAIR MERIDIAN,, CEASER ROAD, ANDHERI WEST,, AMBOLI, MAHARASHTRA, Mumbai Suburban, Andheri, Andheri, 400058","ANURADHA NAYAN SHAH, NAYAN ARVIND SHAH","Director, Managing Director","MAYFAIR KUMKUM, MAYFAIR HERITAGE, MAYFAIR BOULEVARD, MAYFAIR SERENE, MAYFAIR MYSTIC, MAYFAIR SHYAM, MAYFAIR AKSHAY, MAYFAIR GREENS, MAYFAIR ASTRAL, MAYFAIR VISHWARAJA BUILDING D AND E, MAYFAIR VISHWARAJA BUILDING C","Completed, Completed, Completed, Completed, Completed, Completed, Completed, Completed, Completed, Completed, Completed","No, No, No, No, No, No, No, No, No, No, No",,
P51700002065,P51700002065,31/07/2017,MERIDIAN MYSTIC,Ongoing,Residential / Group Housing,Maharashtra,31/12/2018,Others,,78/78A,1849.64,1849.64,2774.45,2773.95,180,"78/78A, MAHARASHTRA, Thane, Thane, Navi Mumbai (M Corp.), 400706, PLOT NO-77, PLOT NO-67A TO 69, 15 MTRS WIDE ROAD, PLOT NO-68, 19.018934039474460, 73.024233258895490",,,"20, GR FLOOR, NIRMAN VYAPAR KENDRA, PLOT NO-10, SECTOR-17, VASHI NAVI MUMBAI, NAVRATNA HOTEL, MAHARASHTRA, Thane, Thane, Navi Mumbai (M Corp.), 400703",,,Meridian Meadows,Completed,No,,
P51500011537,P51500011537,31/08/2017,SAINATHVILLA Phase II,Ongoing,Residential / Group Housing,Maharashtra,31/05/2018,Others,,46,3032.7,3032.7,2057.94,1761.94,477.77,"46, MAHARASHTRA, Aurangabad, Aurangabad, Sundarwadi, 431001, Nala, Land from Gut No 46, Remaining Part Sainath Villa phase I, Cidco Projected Road, 19.858827000000000, 75.442968000000000",Partnership,Sainath Builders & Developers,"Shop no 10, Vyapari Sankul, Bajrang Chowk Road, N-6 Cidco, Near Bajrang Chowk, MAHARASHTRA, Aurangabad, Aurangabad, Aurangabad (M Corp.), 431001","AnandKumar Ramchandra Dugar, Arun Tukaram Dhaihande, Dilip Ramjiprasad Chaurasia","Partner, Partner, Partner",,,,Anandkumar Ramchamdra Dugar,Authorized Signatory
P52100012200,P52100012200,01/09/2017,NANDHA RESIDENCY,Ongoing,Residential / Group Housing,Maharashtra,15/06/2018,Others,,"GAT NO 393 , KOREGAON MUL ,URLIKANCHAN",1571.31,1571.31,1571.31,1347.22,,"GAT NO 393 , KOREGAON MUL ,URLIKANCHAN, MAHARASHTRA, Pune, Haveli, Koregaon Mul, 412202, GAT NO 393 PART, GAT NO 69, PUNE SOLAPUR NATIONAL HIGHWAY, GAT NO 57, 18.488377900000000, 74.102128200000000",,,"10, CHANDRANIWAS, PUNE-SATARA ROAD, PUNE, NEAR CITY-PRIDE THEATRE, MAHARASHTRA, Pune, Haveli, Swargate, 411037",,,,,,,
P50500002280,P50500002280,31/07/2017,SHIVAM PARK,Ongoing,Residential / Group Housing,Maharashtra,31/01/2019,Others,,7/74,1502.45,1502.45,2553.56,1802.34,,"7/74, MAHARASHTRA, Nagpur, Nagpur (Rural), Shankarpur, 441108, PLOT NO 6, PUBLIC UTILITY, SURVEY NO 72, 9M  WIDE ROAD, 21.056573000000000, 79.071419000000000",Partnership,SAMBHAV INFRA,"202, YASHODHAM ENCLAVE, WARDHA ROAD, AJNI SQUARE, HALDIRAM, MAHARASHTRA, Nagpur, Nagpur (Urban), Nagpur (M Corp.), 440015",VIJAY TILOKCHAND BORUNDIYA,Partner,,,,MAYANK VIJAY BORUNDIA,Authorized Signatory
P51800002451,P51800002451,01/08/2017,VIKI HEIGHTS,Ongoing,Residential / Group Housing,Maharashtra,30/11/2018,Others,,5867,652.2,652.2,1895.49,1694,,"5867, MAHARASHTRA, Mumbai Suburban, Kurla, Kurla, 400077, Hem kunj, Shreenathji bhuvan, Vallabhbaug lane, New construction, 19.078961000000000, 72.906927000000000",,,"205, So Lucky  Corner, M G Road, Vile parle east, Sunder Hotel, MAHARASHTRA, Mumbai Suburban, Andheri, Andheri, 400057","Dhaval Vijay karia, Dhaval Karia","Chairperson, ",,,,,
P50500000348,P50500000348,15/07/2017,ROYAL RESIDENCY,New,Residential / Group Housing,Maharashtra,30/11/2020,Others,,"32, 33",456.64,456.64,589.74,589.74,,"32, 33, MAHARASHTRA, Nagpur, Nagpur (Urban), Nagpur (M Corp.), 440015, PLOT, 9 METER WIDE ROAD, 12 METER WIDE ROAD, PLOT NO 31, 21.101756000000000, 79.073969000000000",,,"181, GOPICHAND BORIKAR BHAVAN, BHAGWAN NAGAR ROAD, KUKDE LAYOUT, BEHIND MEDICAL COLLEGE, MAHARASHTRA, Nagpur, Nagpur (Urban), Nagpur (M Corp.), 440027","SANJAY BORIKAR, ELVIS BORIKAR","Managing Director, Managing Director",SILVER RESIDENCY,Completed,No,,
